{
  "schema_version": "0.3.0",
  "trial_id": 6,
  "params": {
    "castellatedMeshControls.nCellsBetweenLevels": 2,
    "refinementSurfaces.pipe_level_mode": 1,
    "refinementRegions.distance_mode": 1,
    "snapControls.nSmoothPatch": 7,
    "snapControls.tolerance_mode": 2
  },
  "objectives": {
    "loss": 107606.0
  },
  "status": "ok"
}
